{
  "id": "bio-workflows",
  "name": "科研工作流模板（Skills）",
  "description": "8 个预设的科研任务模式：文献综述、靶点发现 / 药物重定位、GEO 数据集初筛、端到端单细胞分析、临床试验 landscape、reviewer response、grant Specific Aims，以及横切的不确定性优先（uncertainty-first）收尾标准。每个模板是一个 Skill，靠触发词进入并组合对应 bio-* pack 工具。",
  "version": "0.3.1",
  "dependencies": ["bio-lit", "bio-audit", "bio-norm", "bio-drug", "bio-gene", "bio-trials", "bio-singlecell", "bio-sc-downstream", "bio-scfm", "bio-sc-atlas", "bio-spatial"],
  "requires_tools": [],
  "requires_env": [],
  "depends_on": ["bio-lit", "bio-audit", "bio-norm", "bio-drug", "bio-gene", "bio-trials", "bio-singlecell", "bio-sc-downstream", "bio-scfm", "bio-sc-atlas", "bio-spatial"],
  "servers": [],
  "skills": [
    {"id": "lit-review",           "src": "packs/bio-workflows/skills/lit-review"},
    {"id": "target-discovery",     "src": "packs/bio-workflows/skills/target-discovery"},
    {"id": "geo-triage",           "src": "packs/bio-workflows/skills/geo-triage"},
    {"id": "sc-analysis",          "src": "packs/bio-workflows/skills/sc-analysis"},
    {"id": "trial-landscape",      "src": "packs/bio-workflows/skills/trial-landscape"},
    {"id": "reviewer-response",    "src": "packs/bio-workflows/skills/reviewer-response"},
    {"id": "grant-specific-aims",  "src": "packs/bio-workflows/skills/grant-specific-aims"},
    {"id": "uncertainty-first",    "src": "packs/bio-workflows/skills/uncertainty-first"}
  ]
}
